profile_name,username,text,label,label_name
Mr Daniel | Tech Skills & Remote Jobs,DEO_TechJobs,"🚨 Hiring: Developer Product Marketing Lead  OpenRouter is looking for a Developer Product Marketing Lead to shape product messaging, lead launches, and build AI-powered content systems for developers worldwide.  🌍 Location: Remote 💼 Job Type: Full-time  Requirements  • 5–7 years in Product or Developer Marketing • Strong understanding of APIs, developer tools, and technical products • Exceptional writing, editing, and product positioning skills • Experience with AI-assisted content workflows and developer communities (X, Reddit, Discord)  ✨ Ideal for marketers passionate about AI, developer ecosystems, and building products used by millions.  📩 Apply: https://t.co/ufnyzFuWP9",2,hiring
Summarecon Career,summareconkarir,"WE'RE HIRING! - DEVELOPER  Interested in applying? do visit this link: https://t.co/BREikAfrZB    For more information, please check our website on https://t.co/wL1PCjR16J   Apply now and wish you the best of luck!   #seeyouatsummarecon #summarecon https://t.co/6zQHcxWAqZ",2,hiring
Dionikito,TaofikSulaimon,"Bro, I had one of the craziest experiences while job hunting.  A recruiter reached out saying they wanted to hire me as a developer. We had a proper chat interview they asked technical questions, wanted to know about my recent projects, and even said they'd forward my résumé to the CTO.  About 18 hours later, they came back saying I was shortlisted for a 20 minute team interview. I got excited and started preparing. I joined the meeting, and almost immediately they asked me to install a program before we could continue. My PC started throwing security warnings, and that's when it clicked that something was off.  I closed everything and blocked them right away. Just a heads up: these scammers are getting really convincing. They don't ask for money upfront anymore they build trust first.   If you're interviewing anywhere, be extra careful about downloading unknown software or giving remote access to your machine.  #hiring #developer #cybersecurity",0,irrelevant
Allweb3jobs by Crypto Vazima,crypto_vazima,"💻 Hiring: Multiple Web3 Roles - Koschei Web3 Hub 📍 Remote (Global) | 💼 Early-stage | 🧑‍💻 Solana/Go/Frontend | 🕐 23 hours ago - June 28, 2026  Koschei is a Solana-native real-time risk-intelligence infrastructure analyzing tokens, wallets, liquidity, and transaction risks. The team is actively building ARVIS Security Radar with live on-chain data analysis, evidence-based risk outputs, and developer APIs.  The company is seeking team members especially for:  - Solana / Blockchain Developer - Go Backend Developer - Frontend Developer - Web3 Business Development & Sales - Technical Content / Developer Relations  Ideal candidates love building and taking ownership, want to grow an early-stage product, have interest in Solana/Web3 security/AI infrastructure, and can work remotely with flexible hours.  Note: At this stage, no classic salaried process - project-based, revenue sharing, contribution models or long-term partnership options will be discussed.  📩 To apply: DM Onur Sel on LinkedIn: https://t.co/GgstUGSFLF (Reach out if interested in early growth of a live product and building Koschei together).  🔗 Original post: https://t.co/DMjC3yKqti  ⚠️ DYOR! I don’t verify every job. If someone asks to run files (even from GitHub) or ask for payment 🚩 likely a scam. ❗️ I'm not hiring myself! I just sharing fresh web3/crypto/blockchain roles DAILY for all levels!  💡 For Interns & juniors → https://t.co/F1GGJdA5dq 💼 Mid/senior jobs → https://t.co/50NxWgaLl8  #Solana #Web3 #Blockchain #Hiring #Developer #Golang #Cybersecurity #Startup #Crypto #Remote #SolanaJobs #Web3Jobs #BlockchainDev #Backend #Frontend",0,irrelevant
Ananya,AnanyainTech,Johnson Controls is hiring Developer II / Sr. Developer - Embedded Software Location: Pune Application 🔗: https://t.co/oKXe55a9TD,2,hiring
Allweb3jobs by Crypto Vazima,crypto_vazima,"💻 Hiring: Senior Golang Developer (Web3 & Security) 📍 Remote (Europe, Middle East, India, Pakistan only) | 💼 Full-time | 🧑‍💻 Golang, Web3, Cybersecurity, Distributed Systems | 💰 7K–8.5K USD/month | 🕐 1 day ago - June 26, 2026  The company is hiring a Senior Golang Developer (Web3 & Security) to join a team building scalable decentralized applications, with a strong focus on cybersecurity and distributed systems architecture. The position emphasizes collaboration in an Agile environment to deliver secure DApp solutions.  📋 Responsibilities include: - Develop and maintain scalable microservices using Golang - Design high-level product specifications with a focus on security and performance - Build distributed systems using message brokers and RESTful APIs - Collaborate in an Agile environment to deliver secure DApp solutions  🔑 Requirements: - 5+ years of experience building scalable applications with Golang - Strong background in cybersecurity and cryptography - Experience designing DApps (Ethereum, Arbitrum, Polkadot, etc.) - Proficiency with Docker, Kubernetes, CI/CD, and data streaming  🛠 Nice-to-have: - Knowledge of Auth standards (OAuth2/OIDC) or consensus algorithms (PoS/PoW)  📩 To apply: DM Wubshet Demissie on LinkedIn: https://t.co/mXmI67NoTd to connect with the Veretin Recruitment team.  🔗 Original post: https://t.co/LQttaq4RX0  ⚠️ DYOR! I don’t verify every job. If someone asks to run files (even from GitHub) or ask for payment 🚩 likely a scam. ❗️ I'm not hiring myself! I just sharing fresh web3/crypto/blockchain roles DAILY for all levels!  💡 For Interns & juniors → https://t.co/F1GGJdA5dq 💼 Mid/senior jobs → https://t.co/50NxWgaLl8  #Golang #Web3 #Cybersecurity #Blockchain #BackendDeveloper #RemoteJobs #Cryptography #DistributedSystems #Hiring #Developer #Security #DApps #Kubernetes #Microservices #CICD",0,irrelevant
Leo Parker,tulexaicom,@TTrimoreau Claude API for enterprise is more expensive then hiring developer 😄,2,hiring
Ananya,AnanyainTech,Wipro is hiring Developer L4 City:  Mumbai Mandatory Skills: Flutter 2. Experience: 5-8 Years.   Application 🔗: https://t.co/oK5xJE6NcV,2,hiring
Adam Cohen,adambcohen93,Hiring Developer Relations Engineer. 150-250k base + equity. Looking for someone that knows how to make viral content. Comment below with why you'd be a good fit!,2,hiring
Allweb3jobs by Crypto Vazima,crypto_vazima,"💻 Hiring: Founding Full-Stack Engineer - Huzzle 📍 Remote (Global) | 💼 Full-time | 🧑‍💻 React / TypeScript, PostgreSQL, Supabase | 🕐 4 hours ago - June 15, 2026  The company is hiring a Founding Full-Stack Engineer to join as an early engineering hire and help build a product from zero to launch, owning architecture, user experience, and core platform decisions from day one.  🔑 Requirements include:  - React, TypeScript - Full-stack product development - PostgreSQL, Supabase, scalable backend systems - Real-time applications and edge APIs - System architecture and startup ownership - Blockchain, Web3, AI/LLMs, and fintech products  📩 To apply: Apply here: https://t.co/JDPYjNJSY6  🔗 Original post: https://t.co/MLZqmfDFoH  ⚠️ DYOR! I don’t verify every job. If someone asks to run files (even from GitHub) or ask for payment 🚩 likely a scam. ❗️ I'm not hiring myself! I just sharing fresh web3/crypto/blockchain roles DAILY for all levels!  💡 For Interns & juniors → https://t.co/F1GGJdA5dq 💼 Mid/senior jobs → https://t.co/50NxWgaLl8  #Web3 #Blockchain #FullStack #React #TypeScript #FoundingEngineer #RemoteJobs #Hiring #Developer #Startup #Fintech #AI #Supabase #PostgreSQL #RealTime",0,irrelevant
Hanif | AI For Productivity,hanifproduktif,@pak_erte92 rumor-nya app yg onoh gatot jadi vidio dikasih biar ga dirujak wkwk   orang ampe sekarang mereka masih open hiring developer padahl udah h min berapa ini,2,hiring
Senior intern,isaacmain3,@felix_makinda @StanleyMasinde_ I've sent several application from 2023 and never heard from them. Are they still hiring developer?,2,hiring
Alexa | Startup founder,alexabelonix,"@TerekhinIvan keep it up. we’re hiring developer ambassadors, paid campaigns. form in my pinned post",2,hiring
Ankit Kumar,itsurankit,"We are hiring Developer!  You: - Code in Python/Node.js (or anything that gets shit done)  - Scrape, CLEAN, &amp; structure data (Scrapy, APIs, etc.)  - Build &amp; OPTIMIZE backend systems (DBs, automation, APIs)  - Give a damn about scalability &amp; performance  We care about:   - Code",2,hiring
Allweb3jobs by Crypto Vazima,crypto_vazima,"💻 Hiring: Frontend React Developer - Highwatch AI 📍 Remote / Hybrid | 💼 Full-Time | 🧑‍💻 React.js, TypeScript, Tailwind CSS | 🕐 23 hours ago - June 01, 2026  Highwatch AI is looking for a Frontend React Developer to help build next-generation AI-powered insurance products.  📋 Responsibilities include: - Build scalable web applications using React.js and TypeScript - Develop responsive dashboards and reusable UI components - Integrate REST APIs and AI-powered features - Collaborate with Product, Design, Backend, and AI teams - Optimize application performance and user experience  🔑 Requirements: - 3–6 years of experience with React.js - Strong knowledge of TypeScript, JavaScript, HTML, and CSS - Experience with Redux Toolkit, React Query, and Tailwind CSS - Experience integrating APIs and handling application state - Strong debugging and problem-solving skills  🛠 Preferred: - SaaS product development experience - Experience in Insurance, FinTech, or AI products  📩 To apply: Apply with your Resume, GitHub, and Portfolio. DM Vivek Thakur on LinkedIn: https://t.co/UUGWZ9m5MK  🔗 Original post: https://t.co/9MAq8EZrnu  ⚠️ DYOR! I don’t verify every job. If someone asks to run files (even from GitHub) or ask for payment 🚩 likely a scam. ❗️ I'm not hiring myself! I just sharing fresh web3/crypto/blockchain roles DAILY for all levels!  💡 For Interns & juniors → https://t.co/F1GGJdA5dq 💼 Mid/senior jobs → https://t.co/50NxWgaLl8  #Frontend #React #TypeScript #Tailwind #Web3 #Hiring #Developer #Remote #AI #FinTech #SaaS #JavaScript #Redux #Insurance #TechJobs",0,irrelevant
Votex,votexfrenchfry,"I like how everyone including show so much ignorance and cant think about the development skills it took to learn, up-keeping the game (which yes, youtubers and streamers helped with) developing live events, hiring developer teams and moderation teams, creating updates for years on end, and so much more. There’s a LOT more to this and if Roblox is going to allow something for so long they should give notice. It’s about the respect levels between Roblox and their developers. For you to say someone is undeserving of something shows exactly why you’re someone who should never employ someone who thinks outside of the box and tries to improve your business alongside you.",2,hiring
Ankit Kumar,itsurankit,"We are #hiring Developer!  You: - Code in Python/Node.js (or anything that gets shit done)  - Scrape, CLEAN, &amp; structure data (Scrapy, APIs, etc.)  - Build &amp; OPTIMIZE backend systems (DBs, automation, APIs)  - Give a damn about scalability &amp; performance  We care about:   - Code",2,hiring
Jobhorizons Hub,Remote_JobsNG,"JOB ALERT!!!  HIRING Developer Evangelist – Community – Fully Remote  Location: Remote (Anywhere) Salary: $150K–$175K/year Job Type: Full-Time Schedule: Flexible Remote  ROLE OF THE JOB:  * Create technical content including tutorials, blogs, videos, and SDK/API guides for game developers * Build relationships with developer communities through events, meetups, conferences, and hackathons * Gather developer feedback and collaborate with product teams to improve tools and user experience  Apply Now https://t.co/xNbn4jobEv  Repost and tag someone passionate about gaming, developer advocacy, or technical communities!  #RemoteJobs #GameDevelopment",2,hiring
Ankit Kumar,itsurankit,"We are #hiring Developer!  You: - Code in Python/Node.js (or anything that gets shit done)  - Scrape, CLEAN, &amp; structure data (Scrapy, APIs, etc.)  - Build &amp; OPTIMIZE backend systems (DBs, automation, APIs)  - Give a damn about scalability &amp; performance  We care about:   - Code",2,hiring
Investify Daily,InvestifyDaily,"$HQ: Why I’m Watching Horizon Quantum Beyond the Pullback  $HQ hit ATH a few weeks ago at $42 there has been retracement since. The recent pullback after making all-time highs doesn’t change the long-term thesis. In fact, for early-stage technology companies, sharp corrections after explosive moves are common as traders take profits and the market searches for fair value. The real question is whether the business is improving. For Horizon Quantum, that answer increasingly appears to be yes.  $HQ isn’t trying to win the quantum race by building the best qubit. Instead, it’s building the software infrastructure that allows developers to write quantum applications without needing to understand the complexities of every hardware architecture. Its Triple Alpha platform is designed to be hardware agnostic, allowing applications to run across different quantum systems rather than locking developers into a single vendor. That approach could become increasingly valuable as the quantum ecosystem matures and multiple hardware providers emerge.    One of the biggest long-term catalysts is its strategic relationship with IonQ. Horizon signed an agreement to acquire one of $IONQ first sixth-generation 256-qubit trapped-ion quantum computers, giving it direct access to one of the industry’s most advanced commercial systems. By integrating Triple Alpha with IonQ’s hardware, Horizon can develop and validate its software on frontier quantum machines instead of relying solely on simulations.    This partnership also strengthens Horizon’s position as a software company rather than a hardware competitor. If companies like IonQ, Rigetti, IBM, or others continue advancing quantum hardware, Horizon’s opportunity grows because its software is designed to work across multiple architectures. Rather than betting on a single winner, it’s positioning itself to become part of the software layer that connects developers to quantum hardware.  As quantum computing moves from research labs into commercial deployment, every enterprise will need more than just powerful quantum computers—they’ll need developer tools, compilers, runtime software, and applications that make those machines usable. That’s where Horizon believes it can create long-term value.  This remains a speculative investment. Commercial quantum adoption is still in its early innings, and execution will determine whether Horizon succeeds. But if the industry scales over the next decade, software infrastructure companies could become some of the biggest beneficiaries.  The market may be focused on today’s price action, but long-term investors should be watching execution, partnerships like IonQ, continued expansion of the Triple Alpha platform, and broader enterprise adoption. If those pieces continue falling into place, the recent pullback may ultimately prove to be just another stop on a much larger growth story.",2,hiring
Titus mosiforeba,TMosiforeba,"@supremeanalisis Omo. This guy need developer ooo, that plot of land go design better duplex",0,irrelevant
Shubham Sharma | AI & Tech,editxshub,"@Kalshi Limited preview for 5.6 is telling, they need developer feedback more than hype right now",0,irrelevant
Volodymyr Pavlenko,mindinpanic,"@Kalshi Limited preview for 5.6 is telling, they need developer feedback more than hype right now",0,irrelevant
Crypto Pach,Crypto_pach,"Current holdings and why I'm holding them:  $PRXVT  Building privacy infrastructure for the agent economy through ERC-8183. As AI agents become more common, privacy becomes increasingly important. The team is focused on creating infrastructure rather than another AI application.  Why I'm bullish: • AI + privacy is a massive long-term narrative • Infrastructure projects tend to capture more value than applications • Strong alignment with the growing agent economy • Continues to build around real utility rather than hype  $GITLAWB  Building the git layer for the AI-native internet. If AI agents are going to build, collaborate and deploy autonomously, they need developer infrastructure.  Why I'm bullish: • Developer infrastructure is essential for AI adoption • Building in a sector with very few direct competitors • Strong treasury and liquidity position • Focused on a problem that grows as AI agents grow  $GRANTR  Building around EIP-8131 and account abstraction infrastructure. The goal is to improve how users interact with on-chain applications by making wallets and transactions significantly more seamless while unlocking new functionality for developers and users.  Why I'm bullish: • One of the few projects building directly around the EIP-8131 narrative • Account abstraction is a major step forward for crypto UX • Product launch and ecosystem growth continue to be key catalysts • Focused on infrastructure rather than short-term trends • Small valuation compared to the size of the opportunity if account abstraction sees wider adoption  $DOT  A privacy-first AI ecosystem. DotChat is live, DotImage has shipped and DotMCP enables private inference through on-chain payments.  Why I'm bullish: • Working products already in the market • Combines two major narratives: AI and privacy • Focused on user privacy from the ground up • Building an ecosystem rather than a single product  $LBM  An AI-focused project on Base that continues to expand its ecosystem and presence within the AI sector.  Why I'm bullish: • Exposure to one of crypto's fastest-growing sectors • Strong activity and engagement • Positioned within the broader AI infrastructure trend • Continues to gain visibility across Base  $ETHY  An AI project connected to the growing agent economy on Base. Focused on benefiting from the increasing adoption of autonomous agents.  Why I'm bullish: • Direct exposure to the AI agent narrative • Small market cap compared to many peers • Benefits from continued growth of AI on Base • Positioned in a sector that is still early  $MUTE  A privacy-focused infrastructure project operating in a sector that remains largely overlooked by the market.  Why I'm bullish: • Privacy demand continues to increase • Infrastructure-focused approach • Very small valuation relative to the size of the privacy market • One of the few pure privacy plays available  The common theme across my holdings is straightforward:  • AI Infrastructure • Privacy Infrastructure • Account Abstraction • Developer Tooling  These are sectors I believe will play an important role in the next phase of crypto adoption, which is why they're the areas I'm paying the most attention to.",2,hiring
GOAT Network,GOATNetwork,"The infrastructure for the agent economy is here, secured by Bitcoin.  Now we need developer advocates who can explain it, test it, teach it, and help other builders ship agent products on GOAT Network.  The role, rewards, &amp; application details are here: https://t.co/C4ovTIK0ET https://t.co/AWVES6lMic",2,hiring
Wendy O,CryptoWendyO,"If America wants to be the crypto capital of the world, we need developer protections  We also need equal access for retail or it’s just the same predatory system that we’ve had in the past https://t.co/s2w9Hj7aLv",0,irrelevant
Andre Omietanski,punk6052,"Privacy is normal.  We need developer protections in all jurisdictions, including the EU, to recognise this.  Prosecution of developers like @alex_pertsev in the Netherlands, should never have happened.  Excited to discuss this important topic at the @DutchBlockWeek.",3,build_request
Web3Talks 💜 | PW3,justprotocol,2.   Search for founders posting: 'need developer' 'hiring frontend' 'looking for web developer' 'need landing page' 'website redesign' in Web3 and crypto sectors.,2,hiring
Lava Network 🌋,lavanetxyz,New chains need Developer access from day one.  Lava Public RPC lets blockchains and rollups launch decentralized RPC endpoints instantly backed by a permissionless network of independent Providers.  No single point of failure. From the start. 🌋 https://t.co/KZlZzD3XxV,0,irrelevant
Dasein Gram,Daseingram,"🌟 https://t.co/6fYVahqdhK  Software is entering the physical AI era.  https://t.co/6fYVahqdhK is a premium domain built for the convergence of humanoid robotics, AI coding, autonomous software agents, robotics programming, and next-generation developer platforms.  ✅ Humanoid robotics coding   ✅ AI-powered development tools   ✅ Autonomous code generation for physical AI   ✅ Robotics SDKs, APIs, and developer infrastructure   ✅ A strong brand for the future of intelligent machines    As humanoids enter factories, homes, hospitals, logistics, retail, and public life, they will need more than hardware.  They will need code. They will need intelligence. They will need developer ecosystems.  https://t.co/6fYVahqdhK is built for that future.  #HumanoidCodes #Humanoid #HumanoidRobots #Robotics #AICoding #CodingAI #DeveloperTools #RoboticsProgramming #AIProgramming #PhysicalAI #AIAgents #AgenticAI #AutonomousAgents #SoftwareDevelopment #CodeGeneration #DevTools #AIStartup #RoboticsStartup #TechStartup #FutureOfCode #FutureOfRobotics #PremiumDomain #DomainForSale #BrandableDomain #DomainInvesting #StartupBrand #FutureBrand",0,irrelevant
ZIKORENTALS AGENCY BLOG,HappinessF88022,"I need developer, how much will it cost to develop this similar website. check it out  https://t.co/9ApKZiCosj drop your portfolio on the comment section.",3,build_request
V E C T O R,VectorPrivacy,Interested in testing v0.4.0 Pre-Release?  We are now doing extensive testing across all builds and supported operating systems. We have officially opened up Quality Control Testing for anyone interested. You do not need developer experience.  🪧Drop your nPub or DM to be added. https://t.co/LpSgU0pxhZ,2,hiring
toni,tonitrades_,@podcast_alpha_x @GavinSBaker Fair on Trainium being aggressive vs TPU V8.  But ramp curves need developer adoption too.  JAX and PyTorch-XLA lock-in is Google's real edge that Trainium still has to break through.,0,irrelevant
riRoyal.Base.eth,0xRiRoyal,"gEvening fam, the next AI wave in Web3 will not be built by one interface alone.  it will need developer access.  that is what makes ARC Terminal interesting right now. ARC is moving beyond a user-facing AI terminal and opening more of its intelligence layer through SDK and API access, giving builders a way to plug ANIMA style capabilities into their own products.  • builders can extend ARC beyond one app. • AI workflows become easier to integrate. • product utility can spread through other interfaces. • developers get faster paths into agentic Web3 tools. • the goal is clear: turn ARC from a terminal into infrastructure.  that is a stronger signal than feature shipping. when builders can build on top of the system, the product stops being a destination and starts becoming a layer.",2,hiring
Pendragon ☽,KingPendragon33,"$Dusk  🧵👇🏼  1️⃣ DuskEVM in Plain English  Why “Ethereum-compatible” matters for real products  Finance is changing fast, but building real financial products is still slow.  Not because people lack ideas, but because the plumbing takes forever.  If you’ve ever watched a blockchain project try to integrate with exchanges, wallets, custodians, or standard developer tooling, you’ve seen the problem.  Every custom integration becomes its own mini project.  And mini projects stack up until shipping feels impossible.  That’s the context where DuskEVM matters.  Dusk’s goal isn’t just to be another chain people trade on.  Dusk is aiming to be infrastructure for regulated finance, meaning issuance, trading, clearing, and settlement of real assets in a way that can actually work under real rules.    To get there, you need two things that usually don’t come together.  You need developer speed, and you need a settlement layer built for compliance and reliability.  DuskEVM is the “developer speed” part.",0,irrelevant
UJHUUNWA🎀,UJHUUNWA,I need developer and product owners on my tl pleasee   The tl is basically filled with doctors and other professionals I need relatable audience 🥲  Algo do your thing,0,irrelevant
Hahu,hahuprime,@NVIDIAAIDev @NVIDIAAI Do you mean no need developer?🤲😄,0,irrelevant
Robert Paarl,robertpaarl3,"@LundukeJournal &gt;First you need developer packages for the compile-time dependencies: GDK-Pixbuf, Pango, atk, glib, gettext-runtime, libiconv Now I remember how I never got GNOME 1 running on Solaris back then. KDE2 just installed like make; make install",0,irrelevant
JavaScript Jobs,Javascriptjobbs,"Hiring: OU Health - Web Developer, Patient Acquisition Strategies Location: Remote - United States https://t.co/4sbYHnBSWK #javascript #reactjs #nodejs #vuejs #jobs #hiring  https://t.co/4sbYHnBSWK",2,hiring
Skillners | Global Jobs & Scholarships,skillners,"✅ BigCommerce experience ✅ Portfolio required  📅 Apply before: July 18, 2026  🔗 Apply here: https://t.co/E8DfDJ290h  Tag a web developer who shouldn't miss this opportunity!   #RemoteJobs #WebDeveloper #BigCommerce #JavaScript #HTML #CSS #WorkFromAnywhere #HiringNow #TechJob",2,hiring
Skillners | Global Jobs & Scholarships,skillners,"REMOTE WEB DEVELOPER WANTED!  Have experience with BigCommerce? Here's your chance to work remotely from anywhere in the world!  💼 Role: Web Developer (BigCommerce) 🌍 Location: Worldwide Remote 💰 Salary: $700 USD/month 🕘 Full-Time (9 AM–5 PM EST)  ✅ HTML, CSS &amp; JavaScript",2,hiring
