profile_name,username,text,label,label_name
Matthew Turley,matthewrturley,"A founder paid me to scan their AI-built app. 41 issues came back.  What they thanked me for wasn't the 41 issues. It was the line that said: fix these 3 today, ignore the other 35.  AI will hand you 40 red rows. It can't tell you which one is leaking user data right now and which one is a dev warning you can ignore.  The ranking is the whole job.",0,irrelevant
SirMarty,MartyBee_,"@UniverseIce Its a user friendly, well built app but unless you need the date, time and football score it's pretty bare bones",0,irrelevant
Erik Anderson,primex001,The full 12-point checklist I run before real users depend on an AI-built app:  https://t.co/r8U6fPYTku,0,irrelevant
Lars Jansen,oldstackjournal,"The useful part of a simple stack isn’t nostalgia. It’s inspectability.  When an AI-built app breaks, I want boring clues: a PHP file, a MySQL table, an Apache permission, a log entry I can read.  Clever is fine. Invisible failure modes are expensive.",0,irrelevant
Upsilon,upsilon_it,"Your #AI built app works perfectly... until real users show up 🤖💥The biggest #VibeCoding limitations are not in the demo. They appear in authentication, databases, integrations, deployment, and security. Learn why apps break and how to prevent it 👉https://t.co/rXh3jYY4Uo",0,irrelevant
MazCards,MazLines,Just signed up and tried out @TiltRips . Impressed with what @senortilt and his crewnhave built. App is extremely smooth and I hit nice on my free $10 pack from signing up.   Use sign up link https://t.co/koQPvfgv2s and we both get a free pack!   Can’t wait to see the growth of the site.,0,irrelevant
Maaz🇦🇷🇪🇸,Maazzop,@izack1408 Thank bro it's a in-built app,0,irrelevant
Clinton • TBM 🌹,Clinton_xx,"This Friday, I’m proudly unveiling my very first self built app.",1,launch
Rectangular Sphere,rectanglesphere,@RJCcapital Zuck maybe biggest creep of all time.  -Built app to stalk people  -Built glasses to take stalking next level  -Saving it all in his own special cloud for all eternity while he builds his bunker,0,irrelevant
tea,teaprotocol,"1/ Community Spotlight: OpenSource WTF is live.  @OpensourceWtf is a community-built app that gives people a new way to explore open-source package activity, leaderboard movement, and what is being published across the software graph.",1,launch
RobeAndLizardHat,EquippedGiraffe,"The dumber you, are the more tokens and vram you need.  If you want to come back from lunch, wipe the spittle, cheeto crumbs and ranch dressing off your monitor to see a fully built app, then yes you need infinite vram.  A shoestring budget is fine if you actually like the work.",0,irrelevant
Teksart,TeksCreate,"Claude Science — Anthropic's first dedicated scientific research app.  Just launched on iOS and macOS. Not a wrapper. A purpose-built app for lab work, data analysis, and paper comprehension.  Key features: - Reads and summarizes **entire** research papers (PDFs included) - Extracts figures, tables, and methodology from uploaded datasets - Built-in import from arXiv, PubMed, and institutional repositories - 'Experimental Notebook' mode — keeps context across multi-hour research sessions - LaTeX-aware output for direct paper drafting  This changes the workflow for researchers who manage dozens of papers weekly. Instead of bouncing between Zotero, a reader, and a chat window — one app handles the full pipeline.  Free for individual researchers. Claude Science Pro at $30/month unlocks unlimited paper uploads, longer context sessions, and API export features.  This is the vertical play Anthropic needed. Domain-specific beats general-purpose every time.",1,launch
Amit Amir Anthony,AmitWorldPeace,@Jyotica057 @grok Yes it's a Chinese Built app.,0,irrelevant
DubbsUP,Dubbs_Up,"@SariArhoHavren Like your probably saying this on an iphone developed in america, on an american built app, you watch american movies and tv shows, and listen to music produced in america  then wonder we they say that? lol",0,irrelevant
shivam,shivi205,@marclou Hi @marclou   Could you please suggest how to price the saas.  I built app and people are using it and loving it and I am afraid to ask money from them.  What should I do?,0,irrelevant
Blue Alchemist,Blue8Alchemist,"@devloperhs Yes.. I was a fullstack + UX Designer. Have built app in java, kotlin...  But just love flutter since it was launched.",0,irrelevant
NB,mr_nogs,My ai built app hits 4K installs ;) https://t.co/uRaSm9I9S4,0,irrelevant
Blackwells Home Decor,HomeBlackwells,Your home deserves décor you'll love coming home to. 🏡✨ Explore our newly launched website and discover stylish pieces to refresh every room. Your next favorite find is waiting!  #HomeDecor #ShopHomeDecor #HomeStyle #InteriorInspiration #DecorLovers #HomeDecorFinds https://t.co/S3nsWUzSLP,1,launch
deepa 🏴‍☠️,deeparocks,"inter generational simple vibes public goods infra funded by grants enjoyed by all with the view of solarpunk vancouver inspired by the Cholkit Park of Vancouver + Tokyo Digs a Garden picture book serves as the hero image of Grant Orb AI’s newly launched website for grant makers and everyone allocating funds.  AI for faster, intelligent deployment of funds that shapes society today   link below to grantorb dot com/funding",1,launch
Benedikt Seidel,ben_sdl,"Last week we had our 4th Demo Night (https://t.co/g4IgA6MKxr). From our very first demo night up to this fourth one, the feedback from participants has been amazing, and it is exactly what keeps @DominiqueCAPaul and myself putting on more. We literally have people flying in from Sweden and Poland for these nights. What they find here is a room full of like-minded builders from across Europe.  This time I broke my own rules and ran two demos: a project I built myself, and our newly launched website. On the site (https://t.co/g4IgA6MKxr) you can see the demos we have already run, sign up through our Luma calendar, and send us host or sponsor requests.  Enjoy, and please do not break the website. Feature requests and bold statements go in the comments.  Thank you again to PXR and Daniel Grisar for hosting us and feeding everyone with great food and legal insights. Congratulations to the winners: Finn Rothmann for the most engaging demo with his 3D layer for construction sites, and Mohit Singh Thakur for the bravest demo with his Meeting Agents. I hope you both enjoy the chocolate and the $500 in Codex credits to build more amazing things.  See you at the next Demo Night. Thanks for the design inspo @world_is_web and @simeydotme",1,launch
MNC,MNCLtd,"🌐 Will you be at the Esri User conference? We’d love to meet up! Plus, be sure to explore our newly launched website to see how we help organizations transform: https://t.co/xj2futxUDy https://t.co/7w4Bsyh9dz",1,launch
Plus Accounting,PlusAccounting,"A new edition of Sussex Business Times is out now!  We feature once again and in this issue, we share why we felt this is the right time to pause, reflect on our journey, and reintroduce Plus Accounting as we continue to evolve.  We also take a closer look at our recently launched website. More than just a fresh new design, we explain how it represents how we’ve grown, the way we work today, and the direction we're heading in for the future.  Pick up a copy or read online here > https://t.co/m6Ui3olrgb   #Brighton #SBT #SussexBusinessTimes",0,irrelevant
Niraj Dugar,contliving,Get your credit cards from my newly launched website -   https://t.co/NtkM9xt0I3,1,launch
Zay Gems 🔮,zaygems,"While most people are watching token prices, Cassator has been quietly building across several fronts at once.  The newly launched website is only the visible part of it. 👉 https://t.co/8JeUU88z7D  Behind the scenes, the team is currently engaged in discussions with a potential strategic partner from the United States. What makes this interesting is that the conversation goes far beyond capital. The focus appears to be long-term alignment, ecosystem growth, regulatory considerations, and how both sides could create value together over time.  At the same time, the platform continues expanding its RWA offering. New precious metals assets linked to gold, silver, and platinum have already gone live with staking support, while another batch of metals-themed assets inspired by the upcoming 250th anniversary of the United States is being prepared.  The product side has also been moving quickly. Updated mobile applications, a redesigned web experience, and major backend improvements are all progressing together, laying the groundwork for a more scalable ecosystem.  Sl8 itself is becoming more feature-rich as well. Additional assets have been integrated into the wallet, staking options continue to grow, and the referral program is preparing to evolve into a six-level structure that rewards activity across a much broader network. ⤵️  https://t.co/ACylfh2eBb   https://t.co/DLW5u6225W  Taken individually, each update is meaningful.  Taken together, they paint a picture of an ecosystem expanding its infrastructure, product suite, RWA exposure, and strategic reach at the same time.  As always NFA / DYOR",1,launch
MentalityHQ,mentalityedgehq,"Every moment has a beginning.  Today at 2.00 PM CDT/ 8.00 pm WAT, MENTALITYHQ  will enter a new chapter with THE GENESIS.   The GENESIS represents the origin, foundation,  and the beginning of something greater.  As the first projet to debut alongside our newly launched website, it marks the start of our journey toward building disciplined communities,  digital ecosystems, long-term movements powered by mindset.",1,launch
Milerovv,milerovv777,"★ Momo has officially launched website is live ★  On the website, you can easily create a unique PFP in the project's signature style (the fish-eye look).  The site also allows you to connect your wallet, X account, and Discord  You can easily apply for the WL (Dreamlist), where your activity and engagement will increase your chances of securing a spot on the whitelist  Believe in something. Believe in @momoyumemi (≧◡≦) ♡",1,launch
Bimal Rathnayake,BimalRathnayake,"Even after thousands of cyberattacks targeted our newly launched website within just a few hours of going live, this is our progress. A massive thank you &amp; deep appreciation to the team for their hard work, vigilance &amp; swift action to keep our systems secure and resilient. https://t.co/ImkE7HFGPm",1,launch
Tԋҽ ʅαԃყ Fιʂαყσ 👸🏾❄️,_mofisayo,Notice the strong limited IP crossover between @OriginalBlokyz and @quirkiesnft? Remember how I mentioned their other partnerships in the article I dropped about two weeks ago?  (https://t.co/9LWPrmX1al)  Then you should know you’re really early on the Blok  Go through their recently launched website for all the juicy deets (it’s in their bio👀).,0,irrelevant
0xCipher,CIPHER9333,"personal opinion : went down a rabbit hole on https://t.co/oJpa0n9EdG today and came out with complicated feelings  the concept stopped me immediately like physical designer collectibles built to preserve web3 culture.   - not merch - not tchotchkes  actual limited run artifacts 100 pieces per partner built around the ecosystems and moments that shaped this space,that's one of the cleanest brand narratives i've seen in this space in a long time   there are some problems I noticed  I looked at the actual website, the tagline 'limited-edition designer collectibles built to preserve crypto culture' is repeating over 80 times in the page source right now which means broken render loop in the shopify theme. the kind of bug that makes any developer or serious collector immediately question what's happening behind the scenes also no pricing visible upfront and no supply numbers on the homepage.  onchain provenance mentioned as a benefit with zero explanation of which chain, which contract, or how to actually verify anything  second the account login routes through a generic shopify domain instead of https://t.co/oJpa0n9EdG, this is not a direct exploit but it creates a phishing surface that a bad actor could clone in an afternoon.  the gap between the vision and the execution is the whole story here the idea is legitimately one of the better physical web3 collectible concepts i've come across but the site needs work before the concept gets the audience it deserves  - fix the bug.  - show the prices.  - explain the provenance. - close the login gap.  thats my honest opinion for @OriginalBlokyz newly launched website",0,irrelevant
Maui suzuki,mauiSurfsbig,"I think you’re mixing up two completely different things.  If someone is looking to move $50k–$250k and encounters a transfer issue, then yes, that’s a legitimate concern that should be addressed. Nobody is arguing otherwise. But isolated onboarding or operational issues are not the same thing as evaluating the viability of the network, the technology, or the partnership itself.   Launch issues that have been brought up have mostly been ironed out. Some KYC issues are still on-going (like California residents) and have been updated and addressed by the team. Changes are being implemented as we speak.   As for “all the players are new” and a recently launched website, that’s not exactly uncommon when new entities are formed around specific initiatives, partnerships, or regional deployments. New infrastructure, new subsidiaries, and new operating companies get created all the time for regulatory, legal, and commercial reasons.  I see absolutely nothing odd about this partnership at all. I’m extremely excited for the future of this Network and I don’t think people understand how undervalued this Network truly is!!",0,irrelevant
Mncconcepts2 🦅,Mncconcepts2,"Google and their indexing, 😅 Tried to set up a proper SEO for my newly launched website portfolio.  Indexing is still in process tho.   We'll be the top one on your search soon.  You can still reach us out. https://t.co/5fQyguDRbD",1,launch
Sudharsan G,sudharps,"Name : Brandi Love Real Name : Tracey Lynn Livermore Date of Birth : 29 March 1973 Age : 53 years as of 2026 Height : 5 ft 7 inches [170 cm] Weight : Not publicly disclosed Body Measurement : 36C-27-37 / 34D-26-36 _varies by source_ Ethnicity : English, Polish, German descent / Caucasian Birthplace : Dearborn, Michigan, USA 🇺🇸 / Raleigh, North Carolina, USA 🇺🇸 _varies by source_ Nationality : American 🇺🇸 Current Residence : North Carolina, USA / California, USA  Profession: A🔥ult Film Actress, Entrepreneur, Author, Former Wine Company Owner Career start : 2004 [launched website] / 2007 [first scenes] / 2008 Notable Studios : B🔥zzers, Na🔥ghty America, Vixen, Mofos, Tushy, B🔥cked, Re🔥lity Kings, Digital Playground Total Credits : 240+ / 320+ titles _varies by source_ >[pro]  Awards & Highlights :  . AVN Hall of Fame - Inductee . XRCO Hall of Fame - Inductee . NightMoves Award Best MILF/Cougar Performer 2013 - Won . NightMoves Award Miss Congeniality 2017 - Won . 2025 Pornhub Award Favorite MILF - Won . 2025 XRCO Award MILF of the Year - Won . 2026 AVN Award MILF Performer of the Year - Won . Launched own adult website June 2004 . Co-owner & CFO of No Rivals Media / Naked Rhino Media . Published book: _Getting Wild Sex from Your Conservative Woman_ 2008 . Former elementary school teacher turned wine company owner . Great-granddaughter of stock trader Jesse L. Livermore  Languages : English Also Known As : Tracey Lynne Livermore Relationship status : Married to Chris Potoski 1994-2025 _divorced_ Net worth: 4–8 million USD  Note: Birthplace listed as both Dearborn, MI and Raleigh, NC. Career start listed as 2004 website launch, 2007 first scenes, or 2008 pro debut depending on source.",0,irrelevant
Final Weapon,fnlwpn,Persona 4 Revival Key Art and New Screenshots Revealed on Newly Launched Website https://t.co/p1xybExht5 https://t.co/SHedbdoTSi,1,launch
Creative Solutions الحلول الإبداعية,Creative_sols,"✨We're excited to unveil the newly launched website for MKM Hospitality, a modern, responsive, and professionally crafted digital platform designed to elevate their online presence. 🌐https://t.co/7Fios5abW1 #WebsiteLaunch #WebDesign #WebDevelopment #DigitalPresence #SaudiTech https://t.co/Gcj1HykIw9",1,launch
DeltaV (scaling arc),DeltaV_xyz,"🛳 An ecosystem of founders who ship every week  @surfcashx reached 5.8K users and crossed 200K volume while advancing loans and regional payments.  @captur_go reached 8,920 MAU, 2,640 WAU, and 29.8% stickiness while improving automatic syncing.  @SntryFun reached 3.85M AI security decisions and advanced onchain modules plus front-end swarm visibility.  @MrFreeman0 secured 20+ creator agreements, reached 100K+ Shorts views, and expanded celebrity AI platform pipeline.  @kizzymobile saw one of its highest active net stakes, with volume and revenue trending up.  @AccountableData partnered with Hemi and presented vault infrastructure at Vault Summit as Platinum sponsor.  Quantum Wallet shipped live wallet, marketplace, and dApp interfaces on the Monad network.  @specter_PQ launched transfers on the Monad network and Arbitrum for private cross-chain sending.  @PingMe_xyz advanced Ping Business merchant gateway for stablecoin settlement on the Monad network.  Post and Pick launched user and driver apps on App Store and Google Play for beta testing.  @DenariaFinance deployed first testnet version on Arbitrum Sepolia and launched protocol status monitoring.  @JanusFreight shipped first payment module to staging and advanced production-readiness for logistics payments.  @EmpowerTours shipped two open-source repos covering anomaly detection, AMM routing, simulations, language tools, and quantum prototypes.  @Lka10nft shipped contact lists, navigation, guarded research regeneration, and multi-signal scoring agents.  @everdrawing integrated Pyth VRF for non-manipulatable vault winner draws and began testing the update.  @branchlesspay processed 10 transactions, 2 partner settlements, and 8 active agents on the Monad testnet.  @jichu_xyz deployed validator on the Monad network and launched website foundations.  @allocrypt added Kintsu vault support and continued add-vault workflow cleanup across product surfaces.  @facto_to advanced pool credit model implementation, narrative upgrade, and sandbox discussions with Reap.  @akidirtyhands filed fourth patent and advanced Android NFC onboarding for physical-to-digital testing.  Canonicals drafted three V2 distribution-market research papers and deployed mechanism on Base.  @GweiExchange kicked off full rebrand with new name, visual identity, positioning, and launch-readiness work.  @monatrix_ag published dashboard of top pools, optimized backend, edited UI, and contacted integration protocols.  @ninjaverse_xyz launched testnet product with core mechanics, guides, and bug-hunter reward systems.  @boxtree_inc continued in-app revenue, started Character Labs, and advanced play-test feedback for Spatial Creatures.  @cultverse_ai designed onboarding overhaul and recorded 15% open rate for first Grand Summoning email.  @ThinkeeSenior explored life-scenario modeling, monetization, emotional AI modules, and future digital-heritage architecture.  @FonDevz worked on adding and integrating more teams, with growth dependent on expanding team coverage.  Bottlers added NFT elements to make its product experience more interesting.",1,launch
Susan Dolan,GoogleExpertUK,"@MarionMertins @Blancafaymartin @ThePeoplesHubUK @HousingFirstIRE @LoveFoodLifeGo @SocialHousingCo @BlocksBetty @UKParliament @EINConsumerNews @NewsCCP @Ethical_Banking @ethicalbanking @PaulTay26041122 @WeahsCousin @PeteJacksonGMP @AndyBurnhamGM @RobertKennedyJr @realDonaldTrump @elonmusk @ABridgen @neworder @WhiteHouse @FiveTimesAugust @naomirwolf @MattWallace888 @AndersonAfDMdEP @Theblackfemini3 @georgegalloway @RealDeniseWelch @mjgranger1 @PeterSweden7 @pjhlaw @SpartaJustice @recusant_raja @foundring1 @bobscartoons @Imrah_Baines @SMSPirate @DrLoupis @StefSimanowitz @JacquiDeevoy1 @yashar @TheEmmapreneur @ciabaudo @AceRedBand1t @SecRubio @ErichSaylor @foxblog3 @ErinBrockovich has launched website &amp; begun tracking all data centers in America &amp; logging resident complaints. In 1 week it’s already logged 1,690 resident complaints 🎥 @WallStreetApes https://t.co/b7RenlgDBh https://t.co/MiFGTgYCgm Women were 1st to spread Gospel. #news🇺🇸#ADA",0,irrelevant
Rexxie_Ye🍫🤍🇺🇲🇳🇬🇩🇪,annys__kitchen,"Bringing delicious meals closer to you, one click at a time 🍝 💻     Please support and patronize our newly launched website ❤️  https://t.co/b2xKcXDEXV https://t.co/Xp3CbaPeZw",1,launch
Juleh EV News,JulehMobility,"No app. No hassle. Just scan, pay, & charge. Jaipur-based EV charging startup ChargeJet has launched app-free charging.   Drivers can now scan a QR code, pay, and charge instantly — no app download needed.  A convenient step toward reducing friction in India's #ElectricVehicles charging experience. #JulehEvNews",5,industry_news
Arpit Goriya | Building in Public,arpit_goriya,"You Just launched app and have $0 Marketing Budget, How would you get first 100 Users?",1,launch
Gloo,gloo,"From a college pitch competition to a launched app used by people around the world, see how the team behind Veritas turned a vision into reality at the Gloo AI Hackathon. 🚀 _ Watch the full story: https://t.co/MYyIo6kOtD . . . #GlooStory #HackathonHeroes #AIforGood #TechforGood https://t.co/6daSQgPQqE",1,launch
Mike Stenhouse,MikeStenhouse,"@itsnodesigner Totally depends on timescale. Newly launched app with $500/month in month one and strong signals that growth is going to compound? No deal. But if I’d been plugging away at it for months or years and things were flat, then in a heartbeat.",1,launch
Nikhil Sharma,nikhilmusiic,@RailwaySeva @RailMinIndia @AshwiniVaishnaw what’s the purpose of having tatkal system in India when the common people are not even abel to book it? Why your newly launched app can’t take the load when needed the most? You guys just talk and deliver Zero. Same old story. SHAME!! https://t.co/znQIELzo4Q,1,launch
Chris S,schultzapps,Last September I gave away my newly launched app to Reddit. Around 1000 users downloaded it. 13 have used it in the last 14 days. Shout out to the OGs. https://t.co/RLlM7Vk1vG,1,launch
TermMax | Fixed Rate Borrowing & Lending,TermMaxFi,"Dear TermMax Community, Over the past few months, we've seen many discussions and questions regarding our TGE timeline. We've been paying close attention to community feedback and want to share an update on where things stand today.  Rather than communicating a timeline before we had sufficient confidence in it, we chose to remain focused on building the protocol, strengthening the ecosystem, and advancing launch preparations. We don't want just a TGE. We want a successful launch that supports the long-term growth and sustainability of TermMax.  The crypto industry has experienced significant volatility and uncertainty over the past several months. Market sentiment and liquidity conditions across exchanges and the broader market have continued to evolve, and are being taken into consideration in ongoing launch preparations while we introduced the Rollover feature, successfully launched App V2, and continued improving the user experience across the protocol.  Beyond product development, the protocol has seen significant TVL growth and graduated from YZi Labs EASY Residency Season 3. TermMax also became a validator on Canton Network, a leading institutional blockchain designed to bring financial institutions on-chain. This milestone further strengthens TermMax’s position in regulated institutional markets and marks an important step in expanding its fixed-rate infrastructure into compliant, institution-focused on-chain environments, bridging traditional finance and DeFi.  To ensure a strong launch, TGE preparations remain actively underway, with ongoing coordination across relevant parties as we work through the final stages of preparation. Our team continues to advance these efforts and will share further updates with the community as soon as more definitive information becomes available.  We sincerely appreciate the patience and support shown by our community throughout this journey. The participation and contributions of our community members remain meaningful and will not be overlooked.  We will keep you updated and thank you for your trust and support.  The TermMax Team",0,irrelevant
Mr.Eyi,mreyigungor,"Bartels in Thonglor at Sukhumvit 49 is a great place to focus and just work for hours non-stop, devouring large cups of americano, especially during rain. That is what I do most of my time these days. Building, sharing, organizing events there for a soon to be launched app, that is one of a kind! Highly recommended.",0,irrelevant
